{
  "authority": {
    "authority_hash_contract": null,
    "score_pass_authority_hash": null,
    "selection_integration_config_hash": null
  },
  "identity": {
    "authority": {
      "authority_hash_contract": null,
      "score_pass_authority_hash": null,
      "selection_integration_config_hash": null
    },
    "schema_version": "radjax_tome_semantic_identity_v1",
    "semantic_digest": "sha256:43c6334dc824223aba9b007edf94fb73f853ddc36c9f65c5c7b8c0ec8d5ad29d",
    "training_contract": {
      "sequence_length": 8,
      "target_type": "corridor_exemplar_score_pass_v1",
      "tome_version": null,
      "vocab_size": 512
    },
    "training_payload": [
      {
        "logical_id": "corridors/corridor_modes.json",
        "semantic_digest": "sha256:4ca2a2d13b9b1ce11c2e73964e133ec3426e92fcfacfd4e999d56159d0e1ec89"
      },
      {
        "logical_id": "corridors/corridor_summary.json",
        "semantic_digest": "sha256:7dcd983b89d970a0bd507d8fd181b4d9eb3098b91bdf79f04f373835b2aa7448"
      },
      {
        "logical_id": "corridors/mode_assignments.json",
        "semantic_digest": "sha256:7b223fec5bbe6417e90ee3eb18834aeb1a379872a7ba1dd32573a059f805b2f4"
      },
      {
        "logical_id": "corridors/mode_assignments/examples_metadata.jsonl",
        "semantic_digest": "sha256:2650ae98c9084ab12eac27e02f7499246c697de021d51355fe5ee8e904dea939"
      },
      {
        "logical_id": "corridors/mode_assignments/fingerprint_index.npy",
        "semantic_digest": "sha256:e6095d7edc1a8ff39ae6b195cde075e23126833d9075db36ceb65685a119df6f"
      },
      {
        "logical_id": "corridors/mode_assignments/mode_id.npy",
        "semantic_digest": "sha256:8c2f06a2cdfe41ce6c7f03c623462031674e39f4be790a072fa85db68b7d048e"
      },
      {
        "logical_id": "corridors/mode_assignments/position.npy",
        "semantic_digest": "sha256:0be7c92b2cc3d470c540f9f5018931193863290beb7d9a0f61f9b471383b97c8"
      },
      {
        "logical_id": "corridors/mode_assignments/position_example_index.npy",
        "semantic_digest": "sha256:a789609dd33c6aefa9e48e68e9d331642f6dc15da3f8845f4211ba16ee989d60"
      },
      {
        "logical_id": "corridors/mode_assignments/weight.npy",
        "semantic_digest": "sha256:8878e1a4803f03da31924259bbdd1a2a3530b81eb580e14fdc3a55a7fd36f093"
      },
      {
        "logical_id": "curriculum/selected_routes.json",
        "semantic_digest": "sha256:c5a3479301b1a4209b4cebe5f87a8fc5b5e766827c6e27e53c4293e09df230e6"
      },
      {
        "logical_id": "emission_config.json",
        "semantic_digest": "sha256:59df3afde2f625e3b0f906c3121da2565652c0a810c309c4bd83d4df21b66da8"
      },
      {
        "logical_id": "leaderboards/selected_exemplars.json",
        "semantic_digest": "sha256:73d1c785bbe211c20b8d61e0e00725a2ee08303d08c81480ca4147641aec75f0"
      },
      {
        "logical_id": "metadata.json",
        "semantic_digest": "sha256:daf6cb7ec994ff5feaad0d5e9d574eccdb71f0736c011dcf2f78a9abde773824"
      },
      {
        "logical_id": "selected_exemplars/payload_index.json",
        "semantic_digest": "sha256:5d31a768d8c918d3782c7a1f8f4dc6d5bac32ad81c617e3b6d575858e57bddf1"
      },
      {
        "logical_id": "selected_exemplars/selected-exemplars-00000.json",
        "semantic_digest": "sha256:cc7ac754c3665e19b76fc949372f1e018212e8960a49a917fdee2ed93548df4d"
      },
      {
        "logical_id": "selected_exemplars/selected-exemplars-00001.json",
        "semantic_digest": "sha256:0f11cc225a3d82914effefa3017cf283d4721a0af47557e0ce0f282c4357567e"
      },
      {
        "logical_id": "shards/shard-00000.npz",
        "semantic_digest": "sha256:60f168b98897f807eb188664ec40aca5da247494e2ec48c913dc768aad18262b"
      },
      {
        "logical_id": "shards/shard-00001.npz",
        "semantic_digest": "sha256:d7b86d66dcb012e1f74c267ee3c6fb74d633a4a67b20517a4f6084296e6d13bd"
      },
      {
        "logical_id": "teacher_manifest.json",
        "semantic_digest": "sha256:44ad2ccc07b8dc5f11809e836df25141ccccb0faf497ecfb11abbba21215dcf9"
      },
      {
        "logical_id": "vocab_contract.json",
        "semantic_digest": "sha256:7a1e48633a2379de7425ec314cd926e842f89e1e66a3c67f7b2c82283611d49e"
      }
    ]
  },
  "manifests": {
    "content": {
      "inventory": [
        {
          "classification": "operational",
          "path": "c6/authority_manifest.json",
          "sha256": "sha256:b4250add9f1709e6603181b6debc0a5e796c95863450f1740267520567a80b42",
          "size_bytes": 2429,
          "training_authoritative": false
        },
        {
          "classification": "operational",
          "path": "c6/claims/backfill_lineage.jsonl",
          "sha256": "sha256:e3b0c44298fc1c149afbf4c8996fb92427ae41e4649b934ca495991b7852b855",
          "size_bytes": 0,
          "training_authoritative": false
        },
        {
          "classification": "operational",
          "path": "c6/claims/claim_manifest.json",
          "sha256": "sha256:2d03691dd74bc84e813a8e319898b4155f22c409c68f62ec2c9f3197ee922c92",
          "size_bytes": 5525,
          "training_authoritative": false
        },
        {
          "classification": "operational",
          "path": "c6/claims/collision_obligations.jsonl",
          "sha256": "sha256:e3b0c44298fc1c149afbf4c8996fb92427ae41e4649b934ca495991b7852b855",
          "size_bytes": 0,
          "training_authoritative": false
        },
        {
          "classification": "operational",
          "path": "c6/claims/corridor_claims.jsonl",
          "sha256": "sha256:71dc5a5cdd6c670e227f11edd5329f83e104fd4073ece9c3c361f16479f3e5cd",
          "size_bytes": 560,
          "training_authoritative": false
        },
        {
          "classification": "operational",
          "path": "c6/claims/global_claims.jsonl",
          "sha256": "sha256:6dced817109b1727fbd1de97ac30296d5379042bc925c90838878da184a984b8",
          "size_bytes": 296,
          "training_authoritative": false
        },
        {
          "classification": "operational",
          "path": "c6/claims/selected_coordinates.jsonl",
          "sha256": "sha256:bb5aa15d84899a22045312fd2897e6919a650a49a2981f784b9d3a16fadc5d5d",
          "size_bytes": 649,
          "training_authoritative": false
        },
        {
          "classification": "operational",
          "path": "c6/claims/validation_report.json",
          "sha256": "sha256:5607d8cc7ecc2f2b5c6112d9f357928dd235c8c5820f1b437fd700f1eeb9ea40",
          "size_bytes": 3198,
          "training_authoritative": false
        },
        {
          "classification": "operational",
          "path": "c6/corridor-features/candidate_features.jsonl",
          "sha256": "sha256:0903e2f213e68652769b9fd28a869f26ab0517a4a53494c4f5574429ff45a385",
          "size_bytes": 26443,
          "training_authoritative": false
        },
        {
          "classification": "operational",
          "path": "c6/corridor-features/manifest.json",
          "sha256": "sha256:5f55fdd2551a04f0eb4c3b04ba9a6073c3d3992fa3d64f4c7523b5d698e61f8c",
          "size_bytes": 749,
          "training_authoritative": false
        },
        {
          "classification": "operational",
          "path": "c6/corridor-leaderboards/manifest.json",
          "sha256": "sha256:872323cd8ae6770ff6cda846949fec687603e38ef064648d4371a7312e8cac43",
          "size_bytes": 2445,
          "training_authoritative": false
        },
        {
          "classification": "operational",
          "path": "c6/corridor-leaderboards/mode_leaderboards.jsonl",
          "sha256": "sha256:931b7a68d86f4a58834e2d568850276d063d391ccf77fbc908a3e1738c73920d",
          "size_bytes": 1997,
          "training_authoritative": false
        },
        {
          "classification": "operational",
          "path": "c6/corridor-leaderboards/validation_report.json",
          "sha256": "sha256:c62ea4277a1a764e1d1ce40105e2679ce7512aeace2673446ccb35636cabedc5",
          "size_bytes": 610,
          "training_authoritative": false
        },
        {
          "classification": "operational",
          "path": "c6/coverage-plan/coverage_plan.json",
          "sha256": "sha256:e2f1037ec61f243c5e499cf39e0a642feb6f7ca1cc7c0fbba3ec77def00f0797",
          "size_bytes": 2489,
          "training_authoritative": false
        },
        {
          "classification": "operational",
          "path": "c6/coverage-plan/validation_report.json",
          "sha256": "sha256:6b7a1d12e5419a438477b6ae10003360b10d8e0ffdc432f198a190e322ebe827",
          "size_bytes": 518,
          "training_authoritative": false
        },
        {
          "classification": "operational",
          "path": "c6/global-board-supply.json",
          "sha256": "sha256:e91fe57c5faa5dc97fa0c897d9d1a8d918f27fb8f93e03ec7b7b3f167ed32e2e",
          "size_bytes": 5727,
          "training_authoritative": false
        },
        {
          "classification": "operational",
          "path": "c6/multi-role-selection/legacy_selected_exemplars.json",
          "sha256": "sha256:d37ff843fdb5930226a5aa45c2741c24dfb7ceebca38059fdd9f09dc0d86a818",
          "size_bytes": 4039,
          "training_authoritative": false
        },
        {
          "classification": "operational",
          "path": "c6/multi-role-selection/manifest.json",
          "sha256": "sha256:bc8b3dd7ebdf8158b3d3ed863342fa34f9415d2bc4730ed98cbba9f5f5b1df3c",
          "size_bytes": 3361,
          "training_authoritative": false
        },
        {
          "classification": "operational",
          "path": "c6/multi-role-selection/selected_exemplars.jsonl",
          "sha256": "sha256:a4823d5c0d1fd9a3842bb045579d9b07491e9d9bbccdfbe5695af29c6ea97f04",
          "size_bytes": 2371,
          "training_authoritative": false
        },
        {
          "classification": "operational",
          "path": "c6/multi-role-selection/validation_report.json",